categories,update_date,text
astro-ph nlin.CD physics.plasm-ph physics.space-ph,2015-05-13,astrophysical gyrokinetics kinetic fluid turbulent cascade magnetized weakly collisional plasma theoretical framework plasma turbulence astrophysical plasma solar wind interstellar medium galaxy cluster accretion disk key assumption turbulence anisotropic respect mean magnetic field frequency low compared ion cyclotron frequency energy injected outer scale scale converted heat ultimately done without collision kinetic cascade develops brings energy collisional scale space velocity nature depends physic plasma fluctuation physically distinct scale range kinetic systematically reduced tractable equation inertial range ion gyroscale kinetic cascade split cascade alfvenic fluctuation governed rmhd equation collisional collisionless scale passive cascade compressive fluctuation obey linear kinetic equation along moving field line associated alfvenic component dissipation range ion electron gyroscales cascade kinetic alfven wave kaw cascade governed fluid like electron rmhd equation passive phase space cascade ion entropy fluctuation latter cascade brings energy inertial range fluctuation damped collisionless wave particle interaction ion gyroscale collisional scale phase space lead ion heating kaw energy similarly damped electron gyroscale converted electron heat kolmogorov style scaling relation cascade astrophysical space physical application discussed detail
nlin.PS nlin.SI,2007-09-23,evolution solitary wave undular bore shallow water flow gradual slope bottom friction considers propagation shallow water solitary nonlinear periodic wave gradual slope bottom friction framework variable coefficient korteweg vries equation whitham averaging recent development theory perturbed integrable equation enables improve result adiabatic evolution isolated solitary wave periodic wave train presence variable topography bottom friction modeled chezy law importantly effect factor propagation undular bore essentially unsteady system consideration particular shown combined action variable topography bottom friction generally imposes global restriction undular bore propagation evolution leading solitary wave substantially isolated solitary wave initial amplitude non local effect due nonlinear wave interaction within undular bore lead additional solitary wave amplitude growth predicted framework traditional adiabatic propagation solitary wave slowly varying medium
quant-ph cs.IT math.IT,2009-11-13,limit relation entropy channel capacity per unit cost quantum mechanical diosi feldmann kosloff arrived conjecture stating limit entropy mixture relative entropy system size go infinity conjecture proven density matrix proof analytic us quantum law large number second clarifies relation channel capacity per unit cost classical quantum channel proof lead generalization conjecture
cs.NE cs.AI,2009-09-29,intelligent location simultaneously active acoustic emission source part intelligent acoustic emission locator described part part discus blind source separation delay estimation location simultaneously active continuous acoustic emission source location acoustic emission complicated aircraft frame structure difficult non destructive testing article describes intelligent acoustic emission source locator intelligent locator comprises sensor antenna regression neural network solves location learning example locator tested test specimen test shown accuracy location depends sound velocity attenuation specimen dimension tested area property stored data location accuracy achieved intelligent locator comparable obtained conventional triangulation applicability intelligent locator since analysis sonic ray path avoided promising non destructive testing aircraft frame structure acoustic emission
gr-qc astro-ph,2008-11-26,inference white dwarf binary system round mock lisa data challenge data set report analysis selected single source data set round mock lisa data challenge mldc white dwarf binary implemented end end pipeline consisting grid coherent pre processing unit signal detection automatic markov chain monte carlo post processing unit signal evaluation demonstrate signal detection coherent secure accurate increased accuracy supplemented additional information signal parameter markov chain monte carlo demonstrate markov chain monte carlo routine additionally able determine accurately noise level frequency window interest
math.CO,2007-05-23,algorithm classification smooth fano polytopes algorithm produce classification list smooth fano polytopes input algorithm single namely positive integer algorithm classify smooth fano polytopes isomorphism class smooth fano polytopes isomorphism class smooth fano polytopes
cs.NE cs.AI,2007-05-23,intelligent location simultaneously active acoustic emission source part part describes intelligent acoustic emission locator part discus blind source separation delay estimation location continuous acoustic emission source acoustic emission analysis characterization location developing defect material source often generate mixture various statistically independent signal difficult analysis separation characterization signal component signal various source mode mixing unknown recently blind source separation bs independent component analysis ica solve problem purpose demonstrate applicability ica locate independent simultaneously active acoustic emission source aluminum band specimen promising non destructive testing aircraft frame structure acoustic emission analysis
physics.ed-ph quant-ph,2008-05-14,visualizing teleportation novel way picturing processing quantum information described allowing direct visualization teleportation quantum state providing simple intuitive understanding fascinating phenomenon discussion aimed providing physicist explaining teleportation non scientist basic idea quantum physic explained lay term idea graphical description teleportation arises naturally
hep-th,2007-05-23,quantum field theory curved background spacetime symmetry space symmetry scalar quantum field theory including interacting theory static space time consider euclidean quantum field theory static riemannian manifold isometry generated parameter subgroup either self adjoint unitary quantization analytically continue self adjoint semigroups parameter unitary group thus construct unitary representation isometry associated lorentzian manifold illustrated example hyperbolic space whose lorentzian continuation anti sitter space
math.DG gr-qc,2009-04-20,global theory special finsler manifold aim global presentation theory special finsler manifold introduce investigate globally intrinsically free local coordinate important commonly special finsler manifold locally minkowskian berwald landesberg landesberg reducible reducible semi reducible quasi reducible finsler recurrent recurrent recurrent recurrent recurrent second order like like like like like symmetric isotropic scalar curvature constant curvature scalar curvature curvature global definition special finsler manifold introduced various relationship type considered special finsler manifold local result literature proved globally several result obtained product interesting identity property concerning torsion tensor field curvature tensor field deduced although investigation entirely global comparison reason appendix presenting local counterpart global local definition special finsler space considered
math.CA math.FA,2013-10-15,hardy lorentz space consider hardy lorentz space infty discus atomic decomposition element space interpolation property behavior singular integral operator acting
cond-mat.soft cond-mat.mtrl-sci,2009-11-13,potassium intercalation graphite van der waals density functional potassium intercalation graphite investigated principle theory bonding potassium graphite compound reasonably accounted traditional semilocal density functional theory dft calculation however investigate intercalate formation energy pure potassium atom graphite requires description graphite interlayer binding thus consistent account nonlocal dispersive interaction included seamlessly ordinary dft van der waals density functional vdw phys rev lett vdw stabilize graphite crystal crystal parameter fair agreement experiment graphite potassium intercalated graphite structural parameter binding separation layer binding energy formation energy bulk modulus reported adsorption sub surface potassium absorption energy reported vdw description compared traditional semilocal weakly soften elastic response
cond-mat.soft cond-mat.mtrl-sci,2009-11-13,phase diagram gaussian core nematics simple nematic liquid crystal made parallel ellipsoidal particle interacting repulsive gaussian law identifying relevant solid phase system careful zero temperature scrutiny eleven candidate crystal structure determine melting temperature various pressure value help exact free energy calculation among prominent feature pressure driven reentrant melting stabilization columnar phase intermediate temperature
cond-mat.str-el,2009-11-13,high spin low spin orbital polarization transition multiorbital mott system interplay crystal field splitting hund coupling orbital capture essential physic system electron hole e g shell single site dynamical mean field theory recently developed impurity solver able access strong coupling low temperature filling orbitals location phase boundary computed function coulomb repulsion exchange coupling crystal field splitting hund coupling drive system novel mott insulating phase vanishing orbital susceptibility away half filling crystal field splitting induce orbital selective mott
physics.pop-ph,2015-05-13,intelligent life cosmology shall three argument proposition intelligent life rare universe shall summarize consensus opinion founder modern synthesis simpson dobzhanski mayr evolution intelligent life exceedingly improbable second shall develop fermi paradox existed third shall intelligent life common would available resource die shall quantum mechanical principle unitarity actually form teleology requires intelligent life survive end finally shall argue universe indeed accelerating survival end requires intelligent life though rare evolved several time visible universe shall argue acceleration consequence excess matter antimatter universe shall suggest experiment test claim
astro-ph,2009-06-23,mass radius unseen dwarf companion single lined eclipsing binary hat derive mass radius component single lined eclipsing binary hat consists primary late dwarf secondary system period short day orbit indistinguishable circular demonstrate generally surface gravity secondary star single lined binary undergoing total eclipse characteristic light curve spectroscopic orbit constrains secondary unique line mass radius diagram constant hat assume orbit tidally circularized primary rotation synchronized aligned orbital axis observed line broadening rot sin rot km give primary radius rsun light curve analysis lead radius secondary rsun semimajor axis orbit rsun single lined spectroscopic orbit semimajor axis yield individual mass msun msun hat lie theoretical mass radius model lyon consistent result double lined eclipsing binary describe offer opportunity low end stellar mass radius relation
nucl-th,2008-11-26,coulomb excitation unstable nucleus intermediate energy investigate coulomb excitation low lying state unstable nucleus intermediate energy collision lab sim mev nucleon shown cross section transition larger energy much le mev nucleon retardation effect coulomb distortion relevant energy low mev nucleon high mev nucleon implication study radioactive beam facility discussed
math.FA,2007-05-23,intersection body generalized cosine transforms intersection body represent remarkable class geometric object associated section star body invoking radon transforms generalized cosine transforms relevant fourier analysis main focus article interrelation generalized cosine transforms kind context application investigation family intersection body call lam intersection body latter include intersection body sense koldobsky unit ball finite dimensional subspace l p space particular restriction onto dimensional subspace spherical radon transforms generalized cosine transforms preserve integral geometric structure apply section lam intersection body characterization class body obtained example review fact give proof
cs.DS,2010-01-25,line viterbi algorithm relationship random walk introduce line viterbi algorithm decoding hidden markov model hmms much smaller linear space analysis hmms suggests expected maximum memory decode sequence length hmm low theta log without significant slow compared classical viterbi algorithm classical viterbi algorithm requires space impractical analysis long dna sequence complete human genome chromosome continuous data stream experimentally demonstrate line viterbi algorithm simple hmm gene finding simulated real dna sequence
hep-ph,2008-03-12,experimental effort search neutrinoless double beta decay neutrinoless double beta decay sensitive approach non accelerator particle physic take regime physic beyond standard article brief review experiment search neutrinoless double beta decay following brief introduction process double beta decay result experiment igex heidelberg moscow give indication existence possible neutrinoless double beta decay mode reviewed ongoing effort substantiate early finding presented majorana experiment future experimental allow detailed neutrinoless decay mode discussed
hep-th,2008-11-26,nilpotent symmetry invariance superfield formulation non abelian form gauge theory capture shell shell nilpotent becchi rouet stora tyutin brst anti brst symmetry invariance lagrangian density four dimensional non abelian form gauge theory within framework superfield formalism particular geometrical interpretation nilpotent symmetry invariance lagrangian density language specific quantity defined domain superfield formalism subtle point connected non abelian form gauge theory clarified within framework superfield formalism ordinary gauge theory considered dimensional supermanifold parametrized four spacetime coordinate pair grassmannian variable theta bar theta key result investigation great deal simplification geometrical understanding nilpotent anti brst symmetry invariance
math.AG math.CO,2009-06-03,littlewood richardson polynomial introduce family ring symmetric function depending infinite sequence parameter distinguished basis ring comprised analogue schur function corresponding structure coefficient polynomial parameter call littlewood richardson polynomial give combinatorial rule calculation modifying earlier sagan author rule provides formula polynomial manifestly positive sense graham apply formula calculation product equivariant schubert class grassmannians implies stability structure coefficient manifestly positive formula expansion knutson tao combinatorics puzzle stability apparent formula littlewood richardson polynomial describe multiplication rule algebra casimir element linear lie algebra basis quantum immanants constructed okounkov olshanski
hep-th,2007-05-23,lagrangian quantum field theory momentum picture commutation relation free field possible algebraic commutation relation lagrangian quantum theory free scalar spinor vector field considered mathematical view point source relation employed heisenberg equation relation dynamical variable specific condition uniqueness operator dynamical variable respect class lagrangians paracommutation relation generalization pointed one entail validity heisenberg equation simultaneous fulfillment heisenberg equation uniqueness requirement turn impossible solved redefinition dynamical variable similar normal ordering procedure containing special implies corresponding change admissible commutation relation introduction concept vacuum make narrow class possible commutation relation particular mentioned redefinition dynamical variable reduced normal ordering last restriction class imposed requirement existing effective procedure calculating vacuum mean value standard bilinear commutation relation pointed one satisfy mentioned condition contradict existing data
cond-mat.mtrl-sci,2007-06-09,order epitaxial self assembled quantum dot linear analysis epitaxial self assembled quantum dot saqds interest nanostructured optoelectronic electronic device laser photodetectors nanoscale logic spatial order size order saqds important development usable device likely type order strongly linked thus spatial order strong implication size order spatial order undertaken linear analysis commonly saqd formation surface diffusion analytic formula film height correlation function characterize quantum dot spatial order corresponding correlation length quantify order initial atomic scale random fluctuation relatively small correlation length dot effect wetting potential negligible however correlation length diverge saqds allowed form near critical film height reinforces previous finding anisotropy saqd order present explicit transparent mechanism ordering corresponding analytic equation addition saqd formation nature stochastic process various mathematical aspect regarding statistical analysis saqd formation order presented
math.NT math.CV,2007-06-13,note function article petojevic petojevi verified useful property function generalize kurepa kurepa left factorial function note simplified proof result answer open question stated petojevic finally discus differential transcendency function
math.DS,2010-01-08,dynamical object cohomologically expanding map goal construct invariant dynamical object necessarily invertible smooth self map compact manifold prove take advantage difference rate expansion term sheaf cohomological long exact sequence create unique lift finite dimensional invariant subspace term sequence invariant subspace preceding term allows take invariant cohomological class right circumstance construct unique current type including unique measure type represent class invariant pullback dynamically interesting self map plethora invariant measure uniquess constructed current important mean local growth big compared growth rate cohomological class expanding cohomological class give sufficient marching order system prohibit formation invariant current type say local dynamical subsystem subsheaves sheaf current give condition subsheaf cohomology sheaf containing smoothing argument allows sheaf cohomology current consideration canonically identified derham cohomology group main theorem applied smooth holomorphic
cond-mat.mes-hall,2008-01-19,coincidence oscillation dipole transition persistent current narrow quantum ring electron fractional aharonov bohm oscillation fabo narrow quantum ring electron studied explained analytical way evolution period amplitude magnetic field exactly described furthermore dipole transition ground essentially frequency difference appears oscillation matching oscillation persistent current exactly equality relating observables dynamical parameter
physics.soc-ph,2007-05-23,pairwise comparison typological profile language abstract compare pair language world atlas language structure
math-ph math.MP,2007-05-23,decomposition maple procedure finding integral nonlinear pdes order independent variable propose seemingly finding solution type nonlinear pdes closed form decomposition nonlinear operator sequence operator order shown decomposition process done iterative procedure step reduced solution auxiliary pdes system dependent variable way explicit expression order pde integral decomposable initial pde remarkably order pde linear initial pde linear highest derivative developed implemented maple procedure really solve order pdes independent variable example pdes calculated solution demonstrate potential automatic solving nonlinear pdes
math.AG,2012-03-06,transcendental koll injectivity theorem treat koll injectivity theorem analytic differential geometric viewpoint precisely give curvature condition implies koll type cohomology injectivity theorem main theorem formulated compact ahler manifold proof us space harmonic form zariski open suitable complete ahler metric need neither covering trick desingularizations leray spectral sequence
math.RA,2007-08-22,injective morita context revisited exposition injective morita context connecting bimodule morphisms injective morita alpha context connecting bimodules enjoy local projectivity sense zimmermann huisgen motivated situation trace ideal action compatibility bimodule morphisms needed introduce notion morita semi context morita data investigate injective morita data help static adstatic module establish equivalence intersecting subcategories subcategories module localized colocalized trace ideal morita datum end application morita alpha context ast module injective right wide morita context
hep-ph hep-ex nucl-ex,2008-11-26,strong decay charmed baryon important experimental progress sector heavy baryon past several year strong decay wave wave wave radially excited charmed baryon comparing calculated decay pattern total width available data discus possible internal structure quantum number charmed baryon observed recently
hep-ph hep-ex,2008-11-26,violation beauty decay precision test kobayashi maskawa violation discussed pointing possible signature source violation flavor changing operator current status accurate test summarized
physics.gen-ph,2007-05-23,universal force dark energy dark energy forcing examine model understanding relativity space novel idea fundamental force introduced allows perceive theory relativity einstein equation pesrpective addition providing improved understanding space shown lead resolution dark energy
gr-qc,2008-11-26,linear perturbation matched spacetimes gauge background symmetry critical review linear perturbation matched spacetimes including gauge problem analyse freedom introduced perturbed matching presence background symmetry revisit particular spherically symmetry dimension analysis includes setting boundary layer brane world model shell cosmology
math.OA,2007-05-23,operator algebra associated unitary commutation relation define nonselfadjoint operator algebra generator e n f subject unitary commutation relation form e f j sum f l e k time unitary matrix algebra generalise analytic toeplitz algebra rank graph single vertex classified isometric isomorphism term matrix
astro-ph,2010-11-11,shaping globular cluster mass function stellar dynamical evaporation globular cluster mass function gcmf milky way depends cluster half mass density rho h sense turnover mass increase rho h width gcmf decrease argue expected signature slow erosion mass function initially rose towards low mass predominantly cluster evaporation driven internal body relaxation excellent agreement observed gcmf including dependence internal density rho h central concentration galactocentric distance r gc simple relaxation driven mass loss rate cluster approximated mu ev rho h particular recover insensitivity r gc feature derive literal universality gcmf turnover mass rather significant variation rho h expected outcome relaxation driven cluster disruption plus significant scatter rho h function r gc conclusion evaporation rate assumed depend instead mean volume surface density cluster inside tidal radius mu ev rho mu ev sigma alternative prescription physically motivated involve cluster property rho sigma defined readily observable rho h case normalization mu ev required fit gcmf implies cluster lifetime within range standard value although falling towards low end range analysis depend assumption information velocity anisotropy globular cluster system
math.QA hep-th math-ph math.MP math.RT,2007-05-23,quantum deformation relativistic symmetry discussed quantum deformation lorentz poincare algebra poincare algebra shown almost classical matrix zakrzewski classification correspond twisted deformation abelian jordanian type part twist corresponding matrix zakrzewski classification explicit form
cond-mat.other cond-mat.stat-mech,2009-11-13,matter wave bright soliton finite background spinor bose einstein condensate investigate dynamical property bright soliton finite background spinor bose einstein condensate bec integrable spinor equivalent matrix nonlinear schr dinger equation self focusing nonlineality apply inverse scattering formulated nonvanishing boundary condition resulting soliton solution regarded generalization vanishing boundary condition soliton solution explicit manner according behavior infinity classified kind domain wall type phase shift type type implies ferromagnetic nonzero total spin type implies polar total spin amount zero discus soliton collision particular spin mixing phenomenon confirmed collision involving type result consistent previous study bright soliton vanishing boundary condition dark soliton establish robustness usefulness multiple matter wave soliton spinor becs
hep-th,2008-11-26,something rather nothing everything path integral euclidean geometry recently suggested density matrix universe shown describe microcanonical ensemble quantum cosmology ensemble corresponds uniform weight distribution phase space true physical variable term observable spacetime geometry peaked complex saddle point lorentzian path integral represented recently obtained cosmological instantons limited bounded range cosmological constant inflationary cosmology generated instantons late stage expansion undergo acceleration whose low energy scale attained within concept dynamically evolving extra dimension thus together bounded range early cosmological constant cosmological ensemble suggests mechanism constraining landscape string vacuum simultaneously possible solution dark energy form quasi equilibrium decay microcanonical universe
