categories,update_date,text
cond-mat.soft nlin.PS physics.flu-dyn,2009-11-13,formation density singularity ideal hydrodynamics freely cooling inelastic gas family exact solution employ granular hydrodynamics investigate paradigmatic clustering particle freely cooling dilute granular gas consider large scale hydrodynamic motion viscosity heat conduction neglected arrives equation ideal gas dynamic additional term describing bulk energy loss due inelastic collision employ lagrangian coordinate derive broad family exact non stationary analytical solution depend spatial coordinate solution exhibit type singularity gas density blow finite starting smooth initial condition density blowup signal formation close packed cluster particle density blow c approached maximum density exhibit power law sim c velocity gradient blow sim c velocity remains continuous develops cusp rather shock discontinuity singularity gas temperature vanishes singularity singularity follows isobaric scenario gas pressure remains finite approximately uniform space constant close singularity additional exact solution show density blowup type coexist ordinary shock hydrodynamic field discontinuous finite confirm stability exact solution respect small dimensional perturbation solving ideal hydrodynamic equation numerically furthermore numerical solution local feature density blowup hold universally independently detail initial boundary condition
hep-th,2009-11-13,universality wave discus universality covariant field theory space expanded around wave background according space lagrangian density evaluated restricted field configuration universal sector turn around wave even shell transverse space profile background scalar restrict discussion tensorial field context bosonic string theory consider shell wave argue universality requires existence universal sector world sheet operator whose correlation function insensitive wave nature metric background gauge flux result reproduced world sheet conformal field theory wave non polynomial closed string field theory csft particular argue shell wave ansatz flat transverse space dilaton independent transverse coordinate field redefinition relating low energy effective field theory csft massive mode integrated quadratic field simplification expected shell wave identified side furthermore massless wave field configuration iterative computing massive mode csft equation motion discussed bosonic string theory analysis generalised common neveu schwarz sector superstring
math.PR,2008-06-17,clustering stochastic dimensional gas give quantitative analysis clustering stochastic dimensional gas zero gas consists identical particle randomly distributed real line zero initial speed particle begin move force mutual attraction particle collide stick together forming particle cluster whose mass speed defined law conservation interested asymptotic behavior k n infty k n denotes cluster system initial particle main functional limit theorem k n proof discovered localization aggregation process state behavior particle essentially defined motion neighbor particle
math.DG,2007-06-13,approximate solution dirichlet harmonic map hyperbolic space main following hyperbolic space dimensional corresponding holder function partial partial geometric boundary epsilon exists harmonic map continuous boundary sense euclidean partial epsilon
physics.optics,2007-05-23,experimental photonic flame effect feature result spectral energetical temporal characteristic radiation presence photonic flame effect presented artificial opal posed plate temperature liquid nitrogen boiling point irradiated nanosecond ruby laser pulse produce long term luminiscence duration till ten second finely structured spectrum antistocks part spectrum analogous visible luminescence manifesting delay appeared sample artificial opal posed plate opal infiltrated nonlinear liquid threshold luminiscence reduced spatial disribution bright emmiting area opal surface changed putting frozen nonlinear liquid plate long term blue bright luminiscence took place frozen specie liquid temporal characteristic luminiscence nearly opal matrix
physics.data-an physics.gen-ph,2007-05-23,statistical modeling physical law nonparametric regression statistical modeling experimental physical law probability density function measured variable expressed experimental data kernel estimator kernel determined objectively scattering data calibration experimental setup physical law relates measured variable optimally extracted experimental data conditional average estimator directly kernel estimator corresponds nonparametric regression demonstrated modeling return map noisy chaotic data example nonparametric regression predict future value chaotic series mean predictor error definition predictor quality redundancy expressed mean square distance data point statistic definition predictor cost function minimum predictor cost function proper data estimated
cs.CE cond-mat.stat-mech cs.MS cs.NA physics.data-an,2007-05-23,real option project schedule rops real option project schedule rops three recursive sampling optimization shell outer adaptive simulated annealing asa optimization shell optimizes parameter strategic plan containing multiple project containing ordered task middle shell sample probability distribution duration task inner shell sample probability distribution cost task pathtree develop option schedule algorithm trading risk dimension trd applied develop relative risk analysis among project
math.GR,2009-07-07,group finitely conjugacy class automorphisms combine classical method combinatorial theory theory small cancellation relatively hyperbolic group construct finitely generated torsion free group finitely class conjugate element several result concerning embeddings group another application technique prove every countable realized outer automorphisms finitely generated kazhdan containing exactly conjugacy class
hep-lat hep-ph,2008-11-26,energy density chiral lattice fermion chemical potential recently formulation overlap fermion finite density particular compute energy density function chemical potential temperature shown overlap fermion chemical potential reproduce correct continuum behavior
cond-mat.supr-con cond-mat.str-el,2008-01-16,aspect electron phonon self energy revealed angle resolved photoemission spectroscopy lattice contribution electronic self energy complex correlated oxide fascinating subject lately stimulated lively discussion expectation electron phonon self energy effect simpler material resulted several misconception strongly correlated oxide analyze argument claiming phonons origin self energy effect seen high c cuprate superconductors angle resolved photoemission experiment arpes including temperature dependence doping dependence renormalization effect inter band scattering bilayer system impurity substitution light experimental evidence detailed simulation argument founded
astro-ph,2007-05-23,timing lensing colliding bullet cluster barely enough gravity accelerate bullet semi analytical constraint amount dark matter merging bullet galaxy cluster classical local timing argument consider particle orbit potential model fit lensing data marginally consistent cdm model newtonian gravity total mass cdm msun cold bullet subhalo move bullet ray gas move gas nearly maximum speed accelerable gravity truncated cdm halo hubble even without ram pressure consistency break adopts end error bar bullet gas speed bullet gas would sub cluster halo hubble model gas would invoke unrealistic large amount cdm msun cdm cluster containing msun gas result generalisable beyond relativity speed km easily obtained relativistic mondian lensing angus however mondian little hot dark matter hdm time msun cdm small halo mass time msun barely consistent lensing velocity data
math.GR math.DG,2012-04-11,geometry locally compact group polynomial growth shape large ball get asymptotics volume large ball arbitrary locally compact polynomial growth done geometry generalization pansu thesis particular weakly commensurable simply connected solvable lie lie shadow large ball asymptotic shape suitable renormalization converge limiting compact interpreted geometrically discus speed convergence treat example give application ergodic theory answer question burago left invariant metric recover result stoll irrationality growth series nilpotent group
nlin.SI,2007-05-23,much ado note three representation dimensional lie algebra namely algebra lie point symmetry admitted system five trivial ordinary differential equation order forty four admitted system seven trivial ordinary differential equation order twenty eight admitted trivial ordinary differential equation order hundred forty four
math-ph math.MP math.OA,2007-05-23,conformal field theory operator algebra review recent progress operator algebraic conformal quantum field theory emphasis representation theory classification theory series joint work longo
cs.IT math.IT,2009-11-13,sparsely spread cdma statistical mechanic analysis sparse code division multiple access cdma variation standard cdma spreading signature matrix contains relatively small non zero element presented analysed method statistical physic analysis provides result maximum likelihood decoding sparse spreading code large system limit result case regular irregular spreading matrix binary additive white gaussian noise channel biawgn comparison canonical dense random spreading code
math.FA,2007-05-23,ando inequality convex concave function positive semidefinite matrix ando zhan proved inequality unitarily invariant norm non negative operator monotone infty inverse function inequality recently generalised non negative concave function non negative convex function bourin uchiyama kosem respectively consider question whether inequality obtained ando operator monotone inverse similar generalisation non negative concave convex answer exactly question negative matrix affirmatively special course introduce novel notion dominated majorisation spectrum hermitian matrix hermitian matrix prove relation allows strengthen result bourin uchiyama kosem mentioned
gr-qc,2008-11-26,topology change black hole topological structure event horizon investigated term morse theory elementary process topological evolution understood handle attachment constraint nature black hole topological evolution kind handle attachment dimensional black hole space time handle classified either black white type black handle appear real black hole space time iii spatial section exterior black hole region always connected corollary shown formation black hole horizon horizon must non axisymmetric asymptotically flat space time
