categories,update_date,text
hep-ph,2008-11-26,calculation prompt diphoton production cross section tevatron lhc energy fully differential calculation perturbative quantum chromodynamics presented production massive photon pair hadron collider next leading order perturbative contribution quark antiquark gluon anti quark gluon gluon subprocesses included order resummation initial gluon radiation valid next next leading logarithmic accuracy region phase space specified calculation reliable good agreement demonstrated data fermilab tevatron prediction made detailed test cdf data prediction shown distribution diphoton pair produced energy large hadron collider lhc distribution diphoton pair decay higgs boson contrasted produced qcd process lhc showing enhanced sensitivity signal obtained judicious selection event
math.CO cs.CG,2008-12-13,sparsity certifying graph decomposition describe algorithm ell pebble game color obtain characterization family ell sparse graph algorithmic solution family problem concerning tree decomposition graph special instance sparse graph appear rigidity theory received increased attention recent year particular colored pebble generalize strengthen previous result lee streinu give proof tutte nash williams characterization arboricity decomposition certifies sparsity ell pebble game color expose connection pebble game algorithm previous sparse graph algorithm gabow gabow westermann hendrickson
physics.gen-ph,2008-01-13,evolution earth moon system dark matter field fluid evolution earth moon system described dark matter field fluid meeting division particle field american physical society current behavior earth moon system agrees pattern evolution moon earth system described agrees geological fossil evidence closest distance moon earth billion year ago far beyond roche limit suggests tidal friction primary cause evolution earth moon system average dark matter field fluid constant earth moon system data predicts mar rotation slowing angular acceleration rate rad
math.CO,2007-05-23,determinant stirling cycle number count unlabeled acyclic single source automaton determinant stirling cycle number count unlabeled acyclic single source automaton proof involves bijection automaton marked lattice path sign reversing involution evaluate determinant
math.CA math.FA,2013-10-15,dyadic lambda alpha lambda alpha compute lambda alpha norm alpha dyadic grid consequence description hardy space term dyadic special atom
cond-mat.mes-hall,2015-05-13,bosonic character atomic cooper pair across resonance particle wave function paired atom fermi gas tunable interaction strength controlled feshbach resonance cooper pair wave function examined bosonic character quantified correction bose enhancement factor associated creation annihilation composite particle operator example three dimensional uniform gas definition cooper pair wave function examined chosen reflect diagonal long range order odlro another corresponds pair projection bcs side negative scattering length paired atom described odlro bosonic pair projected definition k f definition give similar result atom occupy corresponding molecular condensate
gr-qc,2008-11-26,polymer quantum mechanic continuum limit rather non standard quantum representation canonical commutation relation quantum mechanic system polymer representation gained attention recent year due possible relation planck scale physic particular followed symmetric sector loop quantum gravity loop quantum cosmology explore aspect relation ordinary schroedinger theory polymer description part derive polymer quantum mechanic starting ordinary schroedinger theory polymer description arises appropriate limit second part consider continuum limit theory namely reverse process start discrete theory try recover back ordinary schroedinger quantum mechanic consider several example interest including harmonic oscillator free particle simple cosmological
cond-mat.mtrl-sci,2009-02-05,numerical solution shock ramp compression material property formulation developed represent material model application dynamic loading numerical method devised calculate response shock ramp compression ramp decompression generalizing previous solution scalar equation numerical method flexible robust matched analytic result high accuracy basic ramp shock solution method coupled solve composite deformation path shock induced impact shock interaction planar interface material calculation capture much physic typical material dynamic experiment without requiring spatially resolving simulation example calculation made loading history metal illustrating effect plastic temperature induced quasi isentropic shock release experiment effect phase transition
astro-ph,2010-03-18,spitzer survey large nearby insterstellar cloud serpens yso population observed irac mips discus result combined irac mips spitzer legacy observation serpens star forming region particular criterion isolating bona fide young stellar object yso extensive background contamination extra galactic object discus property resulting high confidence yso object deg field covered irac mips additional confidence yso outside area identified mips data combined mass photometry describe set result color color diagram compare observed source property theoretical model star disk envelope system modeling subset object appear star disk object exhibit wide range disk property fit actively accreting disk passive disk even possibly debris disk luminosity function yso serpens extends least lsun assumed distance limit inability distinguish yso extra galactic source lack yso low luminosity spatial clustering analysis show nominally le evolved yso highly clustered later stage background extra galactic population fit point correlation function seen extra galactic study match several previous infrared ray study serpens yso population spitzer data
math.CO,2007-05-23,partial cube structure characterization construction partial cube isometric subgraphs hypercubes structure graph defined mean semicubes djokovi winkler relation play important role theory partial cube structure employed characterize bipartite graph partial cube arbitrary dimension characterization established proof result operation cartesian product pasting expansion contraction process utilized construct partial cube old one particular isometric lattice dimension finite partial cube obtained mean operation calculated
math.NT math.AG,2008-08-20,computing genus hilbert siegel modular form sqrt jacquet langlands correspondence algorithm computing hecke eigensystems hilbert siegel cusp form real quadratic field narrow class give illustrative example quadratic field sqrt example identify hilbert siegel eigenforms possible lift hilbert eigenforms
math.NT,2007-05-23,distribution integral fourier coefficient modular form half integral weight modulo prime recently bruinier ono classified cusp form sum infty f lambda gamma chi cap mathbb satisfy distribution modulo odd prime rankin cohen bracket extend modular form half integral weight prime geq application main theorem derive distribution property modulo prime geq trace singular modulus hurwitz class analogue newman conjecture overpartitions
math.NT,2008-05-26,adic limit weakly holomorphic modular form half integral weight serre obtained adic limit integral fourier coefficient modular form sl mathbb extend serre weakly holomorphic modular form half integral weight gamma proof linear relation among fourier coefficient modular form half integral weight application obtain congruence borcherds exponent congruence quotient eisentein series congruence value function point studied furthermore congruence fourier coefficient siegel modular form maass space obtained ikeda lifting
math.CA math.AT,2009-09-29,iterated integral loop product article discus relation string topology differential form theory chen iterated integral cyclic bar complex
hep-th,2009-11-13,fermionic superstring loop amplitude pure spinor formalism pure spinor formulation ten dimensional superstring lead manifestly supersymmetric loop amplitude expressed integral pure spinor superspace explores method evaluate integral us calculate kinematic factor loop loop massless four point amplitude involving four ramond state
hep-ph,2008-12-18,lifetime doubly charmed baryon evaluate lifetime doubly charmed baryon xi xi omega carefully calculate non spectator contribution quark level cabibbo suppressed diagram included hadronic matrix element evaluated simple non relativistic harmonic oscillator numerical result generally consistent obtained author diquark however theoretical prediction lifetime order larger upper limit recent selex measurement discrepancy would clarified future experiment accurate experiment still confirms value selex collaboration must unknown mechanism explored
astro-ph,2009-06-23,spectroscopic observation intermediate polar hydra quiescence result spectroscopic observation intermediate polar hya quiescence presented spin modulated radial velocity consistent outer disc origin detected spin pulsation modulated velocity near velocity consistent material circulating outer edge accretion disc suggesting corotation accretion curtain material near roche lobe radius furthermore spin doppler tomograms revealed evidence accretion curtain emission extending velocity finding confirmed theoretical prediction king wynn belle norton hya predict large accretion curtain extend distance close roche lobe radius system evidence overflow stream material falling onto magnetosphere observed confirming belle disc overflow hya quiescence outburst appears hbeta hgamma spin radial velocity originated rotation funnel outer disc edge halpha produced due flow material along field line far white dwarf narrow component close white dwarf broad base component agreement accretion curtain
hep-th,2007-05-23,quest generalized callias index theorem give prescription compute callias index regulator exponential function agreement old result odd dimension computing dimension modulus space self dual string formulated index even dimensional loop space think regulator letter applied index
math.PR math.AG,2007-06-23,approximation extinction probability contact process obner basis note give getting series approximation extinction probability dimensional contact process obner basis
hep-ex,2015-06-30,measurement hadronic form factor nue decay shape hadronic form factor decay nue measured independent analysis compared theoretical calculation data recorded babar detector pepii electron positron collider corresponding decay branching fraction relative decay measured nue result world average value normalization form factor determined uncertainty statistical systematic external input respectively
nlin.PS physics.chem-ph q-bio.MN,2007-07-24,molecular synchronization wave array allosterically regulated enzyme spatiotemporal pattern formation product activated enzymic reaction high enzyme concentration investigated stochastic simulation catalytic turnover cycle individual enzyme become coherent complex wave pattern molecular synchronization develop analysis mean field approximation indicates observed pattern presence hopf wave bifurcation considered system
math.NA,2007-10-16,stochastic lie integrator lie integrator nonlinear stochastic differential equation non commutative vector field whose solution evolves smooth finite dimensional manifold lie action generates transport along manifold pull back stochastic flow manifold lie action subsequently pull back flow corresponding lie algebra exponential map construct approximation stochastic flow lie algebra closed operation push back lie manifold thus ensuring approximation lie manifold call scheme stochastic munthe kaas method deterministic counterpart stochastic lie integration scheme castell gaines method involve underlying ordinary differential integrator approximate flow generated truncated stochastic exponential lie series become stochastic lie integrator scheme munthe kaas method underlying ordinary differential integrator castell gaines method uniformly accurate corresponding stochastic taylor scheme lastly demonstrate method simulating dynamic free rigid body satellite autonomous underwater vehicle perturbed independent multiplicative stochastic noise process
astro-ph,2009-06-23,alma ideal probe solar chromosphere nature solar chromosphere structuring dynamic remains far properly understood spite intensive research point potential chromospheric observation millimeter wavelength resolve long standing computation carried sophisticated dynamic solar chromosphere due carlsson stein demonstrate millimeter emission extremely sensitive dynamic process chromosphere appropriate wavelength look dynamic signature range suggests high resolution observation wavelength alma unique reacting hot cool gas thus potential distinguishing rival model solar atmosphere thus initial result obtained observation quiet sun bima array resolution arcsec reveal significant oscillation amplitude frequency mhz tendency toward short period oscillation internetwork longer period network region however spatial resolution alma required clean separation feature within solar atmosphere adequate comparison output comprehensive dynamic simulation
nlin.PS,2007-05-30,formation quasi soliton transverse confined ferromagnetic film medium formation quasi spin wave waveform longitudinally magnetized stripe ferrimagnetic film observed space resolved brillouin light scattering linear regime confinement decrease amplitude dynamic magnetization near lateral stripe edge thus effective dipolar pinning dynamic magnetization take place edge nonlinear regime stable spin wave packet propagating along waveguide structure transversal instability interaction side wall waveguide important observed experiment numerical simulation pulse evolution shape formed waveform behavior strongly influenced confinement
cond-mat.str-el cond-mat.stat-mech,2015-05-13,spectroscopic property polarons strongly correlated system exact diagrammatic monte carlo recent advance understanding ground excited state electron phonon coupled system obtained novel method diagrammatic monte carlo stochastic optimization enable approximation free calculation matsubara green function imaginary time perform unbiased analytic continuation real frequency exact numeric result ground property lehmann spectral function optical conductivity strongly correlated system frohlich polaron rashba pekar exciton polaron pseudo jahn teller polaron exciton interacting phonons hole
math.RA,2007-11-22,placeholder substructure meta fractal made box kite fill infinite dimensional sky zero divisor zds cayley dickson process cdp dimensional hypercomplex number power least represent singularity approach infinite fractal thereby scale free network integer greater power generates meta fractal sky interpreted strut constant ensemble octahedral vertex figure box kite fundamental building block zds remarkably simple bit manipulation rule recipe tool transforming fractal genus others within context wolfram class complexity
cond-mat.mes-hall,2009-09-24,filling factor dependent magnetophonon resonance graphene describe peculiar fine structure acquired plane optical phonon gamma point graphene brought resonance inter landau level transition material effect pronounced lattice mode associated band graphene raman spectrum resonance inter landau level transition magnetic field measure strength electron phonon coupling directly filling factor dependence experimentally detect circularly polarized lattice mode
math.CA math.PR,2014-07-31,pfaffians hafnians product real linear functionals prove pfaffian hafnian version lieb inequality determinant permanent positive semi definite matrix hafnian inequality improve esz sarantopoulos norm product linear functionals real euclidean space subject sometimes real linear polarization constant
hep-ph,2010-04-23,understanding flavor symmetry breaking nucleon flavor spin structure within chiral quark xqm quark emit goldstone boson flavor symmetry breaking goldstone boson emission process intepret nucleon flavor spin structure inner structure constituent quark implied xqm caused goldstone boson emission process nucleon simplified hamiltonian xqm intrinsic wave function constituent quark determined obtained transition probability emission goldstone boson quark give reasonable interpretation flavor symmetry breaking nucleon flavor spin structure
cond-mat.str-el,2015-05-13,tuning correlation effect electron phonon interaction investigate effect tuning phonon energy correlation effect model electron phonon interaction dmft regime itinerant electron instantaneous electron phonon driven correlation static distortion compete similar energy scale several interesting result including crossover band mott behavior spectral function leading hybrid band mott feature spectral function phonon frequency slightly larger band width since optical conductivity depends sensitively form spectral function regime observable low frequency form optical conductivity resistivity double kondo peak arrangement
hep-ph,2008-11-26,crystal channeling lhc forward proton preserved distribution phase space crystal trap broad distribution particle channel preserved high precision sampled hold distribution steered bent crystal analysis downstream simulation tev large hadron collider crystal adapted accelerator lattice trap diffractively scattered proton emerging interaction point divergence time critical angle criterion crystal adaptation improving efficiency fold proton angle preserved crystal transmission accuracy microrad make feasible crystal application measuring forward proton lhc
hep-ph,2008-11-26,probing non standard neutrino interaction supernova neutrino analyze possibility probing non standard neutrino interaction nsi short detection neutrino produced future galactic supernova consider effect nsi neutrino propagation envelope within three neutrino framework paying special attention inclusion nsi induced resonant conversion take place deleptonised inner layer possibility detecting nsi effect megaton water cherenkov detector either modulation effect bar nu e spectrum due passage shock wave envelope dependence electron fraction iii earth matter effect finally possible detectability neutronization nu e burst bar nu e spectrum exhibit dramatic feature due internal nsi induced resonant conversion occurs non universal nsi strength small flavor changing nsi time
physics.optics physics.comp-ph,2022-03-31,convergence discrete dipole approximation theoretical analysis performed rigorous theoretical convergence analysis discrete dipole approximation dda prove error measured quantity bounded sum linear quadratic term size dipole latter range dda applicability linear term significantly smaller cubically non cubically shaped scatterers therefore small error cubically shaped particle much smaller non cubically shaped relative importance linear term decrease increasing size hence convergence dda large enough scatterers quadratic common range extensive numerical simulation carried wide range finally discus development dda consequence convergence
q-bio.PE q-bio.CB quant-ph,2007-05-23,origin adaptive mutant quantum measurement supplement arxiv bio containing text correspondence sent nature
physics.optics physics.comp-ph,2008-07-29,convergence discrete dipole approximation extrapolation increase accuracy propose extrapolation allows accuracy improvement discrete dipole approximation computation studied empirically extensive simulation test case discretizations quality extrapolation improves refining discretization reaching extraordinary especially cubically shaped particle order magnitude decrease error demonstrated propose estimate extrapolation error proven reliable finally propose simple directly separate shape discretization error illustrated test
q-bio.QM q-bio.MN,2011-11-09,remark steady state multiple futile cycle multisite phosphorylation dephosphorylation cycle motif repeatedly cell signaling motif generate variety dynamic behavior like bistability ultrasensitivity without direct positive feedback positive steady state multisite phosphorylation dephosphorylation cycle positive steady state varies changing biological parameter analytically parameter range least even odd steady state never steady state particular implies including single level mapk cascade three steady state parameter near standard michaelis menten quasi steady condition steady state parameter far standard michaelis menten quasi steady condition steady
physics.optics physics.comp-ph,2007-05-23,discrete dipole approximation simulation light scattering particle much larger wavelength manuscript investigate capability discrete dipole approximation dda simulate scattering particle much larger wavelength incident light describe optimized publicly available dda computer program process large dipole required simulation numerical simulation light scattering sphere size parameter refractive index respectively presented compared exact result mie theory error integral angle resolved scattering quantity generally increase systematic dependence computational time increase steeply reaching value week cluster processor main distinctive feature computer program ability parallelize single dda simulation cluster computer allows simulate light scattering large particle like one considered manuscript current limitation possible way improvement discussed
physics.optics physics.comp-ph,2022-03-30,discrete dipole approximation overview recent development review discrete dipole approximation dda simulate light scattering arbitrarily shaped particle put historical context discus recent development taking viewpoint framework integral equation electric field review theory dda numerical aspect latter critical importance practical application finally position dda among method light scattering simulation shown possible future development discussed
hep-ph hep-lat nucl-th,2008-11-26,scalar radius pion zero form factor quadratic pion scalar radius pi play important role precise determination scattering recently yndur omn representation null isospin non strange pion scalar form factor obtains pi value larger calculated solving corresponding muskhelishvili omn equation pi large discrepancy value precision result reanalyze yndur imposing continuity resulting pion scalar form factor tiny change input phase shift zero form factor wave matrix required accounted resulting value ra main source error determination experimental uncertainty low energy wave phase shift another important contribution error yet settled asymptotic behaviour phase scalar form factor qcd
math.OA math.FA,2008-09-05,multilinear function series conditionally free probability amalgamation case freeness monotonic independence notion conditional freeness meaningful complex valued state replaced positive conditional expectation framework present several positivity result version central limit theorem analogue conditionally free transform constructed mean multilinear function series
math.QA math-ph math.MP,2009-11-13,quantum isometry classical noncommutative geometry formulate quantum generalization notion riemannian isometry compact riemannian manifold introducing natural notion smooth isometric action compact quantum classical noncommutative manifold described spectral triple proving existence universal object quantum isometry category compact quantum group acting smoothly isometrically possibly noncommutative manifold satisfying regularity assumption fact identify quantum isometry universal object bigger category namely category quantum family smooth isometry defined along line woronowicz soltan construct spectral triple hilbert space form noncommutative manifold equivariant respect natural unitary representation quantum isometry give explicit description quantum isometry group commutative noncommutative torus context obtain quantum double torus defined cite hajac universal quantum holomorphic isometry noncommutative torus
physics.gen-ph quant-ph,2010-04-26,system theory like quantum semantics fuzzy set outlined possibility extend quantum formalism relation requirement system theory done quantum semantics arising deep logical structure quantum theory possible taking account logical openness relationship observer system going considering truth value quantum proposition within context fuzzy set useful systemics conclusion propose example formal quantum coherence
cond-mat.stat-mech cond-mat.mtrl-sci,2007-11-19,nonequilibrium entropy limiter lattice boltzmann method construct system nonequilibrium entropy limiter lattice boltzmann method lbm limiter erase spurious oscillation without blurring shock affect smooth solution lbm flux limiter finite difference finite volume finite element method lbm main idea behind construction nonequilibrium entropy limiter scheme transform field scalar quantity nonequilibrium entropy family limiter restriction nonequilibrium entropy entropy trimming filtering nonequilibrium entropy entropy filtering physical property lbm additional benefit control entropy production accurate estimate introduced artificial dissipation possible constructed limiter tested classical numerical example athermal shock tube initial density ratio lid driven cavity reynolds number coarse grid limiter construction applicable entropic non entropic quasiequilibria
